{
  "schemaVersion": "3.0.0",
  "id": "rights-ipa-2018h30h-fe-pm-12",
  "holders": [
    "独立行政法人情報処理推進機構（IPA）"
  ],
  "basis": "official_policy",
  "checkedOn": "2026-10-27",
  "evidence": [
    {
      "sourceId": "source-ipa-faq",
      "locator": {
        "section": "その他／試験の過去問題の使用方法／留意点"
      }
    },
    {
      "sourceId": "source-ipa-2018h30h-fe-pm-12-qs",
      "locator": {
        "section": "平成30年度 春期 基本情報技術者試験 午後 問12 原問題",
        "page": 63,
        "year": 2018,
        "period": "春期",
        "exam": "基本情報技術者試験",
        "subject": "旧制度・午後",
        "timeSlot": "午後",
        "questionNumber": "12"
      }
    },
    {
      "sourceId": "source-ipa-2018h30h-fe-pm-12-qs",
      "locator": {
        "section": "平成30年度 春期 基本情報技術者試験 午後 問12 原問題",
        "page": 64,
        "year": 2018,
        "period": "春期",
        "exam": "基本情報技術者試験",
        "subject": "旧制度・午後",
        "timeSlot": "午後",
        "questionNumber": "12"
      }
    },
    {
      "sourceId": "source-ipa-2018h30h-fe-pm-12-qs",
      "locator": {
        "section": "平成30年度 春期 基本情報技術者試験 午後 問12 原問題",
        "page": 65,
        "year": 2018,
        "period": "春期",
        "exam": "基本情報技術者試験",
        "subject": "旧制度・午後",
        "timeSlot": "午後",
        "questionNumber": "12"
      }
    },
    {
      "sourceId": "source-ipa-2018h30h-fe-pm-12-qs",
      "locator": {
        "section": "平成30年度 春期 基本情報技術者試験 午後 問12 原問題",
        "page": 66,
        "year": 2018,
        "period": "春期",
        "exam": "基本情報技術者試験",
        "subject": "旧制度・午後",
        "timeSlot": "午後",
        "questionNumber": "12"
      }
    },
    {
      "sourceId": "source-ipa-2018h30h-fe-pm-12-qs",
      "locator": {
        "section": "平成30年度 春期 基本情報技術者試験 午後 問12 原問題",
        "page": 67,
        "year": 2018,
        "period": "春期",
        "exam": "基本情報技術者試験",
        "subject": "旧制度・午後",
        "timeSlot": "午後",
        "questionNumber": "12"
      }
    },
    {
      "sourceId": "source-ipa-2018h30h-fe-pm-12-ans",
      "locator": {
        "section": "平成30年度 春期 基本情報技術者試験 午後 問12 解答例",
        "page": 1,
        "year": 2018,
        "period": "春期",
        "exam": "基本情報技術者試験",
        "subject": "旧制度・午後",
        "timeSlot": "午後",
        "questionNumber": "12"
      }
    }
  ],
  "scope": "2018年度春期午後問12の原本文・全選択肢・図表・注記とANS物理p1の当該公式解答。添付資料は別rightへ分離。",
  "uses": {
    "repositoryRedistribution": "allowed",
    "browserDisplay": "allowed",
    "adaptation": "allowed"
  },
  "licenseId": "LicenseRef-IPA-Public-Questions",
  "modificationNoticeRequired": true,
  "attributionText": "出典：平成30年度 春期 基本情報技術者試験 午後 問12 原問題／©2018 独立行政法人情報処理推進機構（IPA）",
  "thirdParty": {
    "status": "none_identified",
    "rightsRefs": [],
    "notes": "原冊子の当該範囲を担当者が全頁照合した記録及び原画像と候補85点の独立画素比較により対象を特定。特定の第三者資料からの引用・転載表示又は第三者規格本文・API資料の再録を当該範囲では識別していない。IPA過去問題FAQの教育教材利用・出典記載・改変明示に基づく用途判断。"
  },
  "assessmentNotes": "原冊子の当該範囲を担当者が全頁照合した記録及び原画像と候補85点の独立画素比較により対象を特定。特定の第三者資料からの引用・転載表示又は第三者規格本文・API資料の再録を当該範囲では識別していない。IPA過去問題FAQの教育教材利用・出典記載・改変明示に基づく用途判断。 本プロジェクト内の用途・素材範囲の判断。別問題・年度への包括適用、第三者の権利不存在の保証又は外部の法的評価ではない。通常アプリ・内容・全冊子のリリース検証は別工程。"
}
