{
  "schemaVersion": "3.0.0",
  "id": "rights-ipa-2017h29a-fe-pm-13-notation",
  "holders": [
    "独立行政法人情報処理推進機構（IPA）"
  ],
  "basis": "official_policy",
  "checkedOn": "2026-10-26",
  "evidence": [
    {
      "sourceId": "source-ipa-faq",
      "locator": {
        "section": "その他／試験の過去問題の使用方法／留意点"
      }
    }
  ],
  "scope": "2017年度秋期午後問13 notation の個別範囲に限定。本文・専用仕様・共通記法を一括して許諾しない。",
  "uses": {
    "repositoryRedistribution": "allowed",
    "browserDisplay": "allowed",
    "adaptation": "allowed"
  },
  "licenseId": "LicenseRef-IPA-Public-Questions",
  "modificationNoticeRequired": true,
  "attributionText": "出典：平成29年度 秋期 基本情報技術者試験 午後 問13／©2017 独立行政法人情報処理推進機構（IPA）",
  "thirdParty": {
    "status": "none_identified",
    "rightsRefs": [],
    "notes": "2017年度秋期午後問13の当該source範囲を全頁照合し、特定の第三者作品からの引用・転載を識別していない。別の大問・付属資料へ判断を拡張しない。"
  },
  "assessmentNotes": "IPAの過去問題利用FAQの教育教材利用条件に基づき、当該範囲を教材としてGitへ同梱・ブラウザ表示・原形式を保って改変する。出典、IPA著作権、原問と改変の区別を表示し、公式依存部分をMIT/CC0へ変更しない。個別の素材・表現・条件を査読したプロジェクト内の判断であり、第三者権利が全て存在しないことの保証又は新たな許諾ではない。"
}
