{
  "schemaVersion": "3.0.0",
  "id": "rights-ipa-2023-a",
  "holders": [
    "独立行政法人情報処理推進機構（IPA）"
  ],
  "basis": "official_policy",
  "evidence": [
    {
      "sourceId": "source-ipa-faq",
      "locator": {
        "section": "その他／試験の過去問題の使用方法／留意点"
      }
    },
    {
      "sourceId": "source-ipa-public",
      "locator": {
        "section": "冒頭の使用条件"
      }
    }
  ],
  "scope": "2023年度FE科目Aの収録した公開問題。問題部分の切出し画像、選択肢ラベル、公式解答の教育目的での同梱・表示。 これらを基にした改変問題の原部分にも同条件を適用し、独自の追加表現・解説・作図データはrights-originalと区別する。",
  "uses": {
    "repositoryRedistribution": "allowed",
    "browserDisplay": "allowed",
    "adaptation": "allowed"
  },
  "attributionText": "©2023 独立行政法人情報処理推進機構（IPA）",
  "modificationNoticeRequired": true,
  "licenseId": "LicenseRef-IPA-Public-Questions",
  "thirdParty": {
    "status": "none_identified",
    "notes": "収録部分の本文、図表、巻末表示を確認。第三者への帰属を示す引用・出所表示は特定しなかった。会社名・製品名の商標表示は巻末にある。これは権利不存在の保証ではない。",
    "rightsRefs": []
  },
  "checkedOn": "2026-10-16",
  "assessmentNotes": "公表問題の教育目的利用案内と出典・改変表示条件を用途別に評価。GitHub、画像化、ブラウザ表示を個別に名指しする許諾を取得したわけではない。公式画面やロゴ、第三者教材の許可へ拡張しない。 2026-10-15に公式FAQの過去問題使用案内と公開問題ページの条件を再確認。問11の詳細解説は元の流れ図を基にした改変表示として原出典・IPA権利・変更内容を明示し、独自解説・コードを区別する。 2026-10-15：問1の小数変換を全12方向に拡張する改変についても公式FAQ・公開問題ページの出典／改変表示条件を再確認。原問題の文章・選択肢・公式正答はIPA条件を保持し、追加の生成計算・誤答・独自解説はrights-originalと区別する。問1に第三者素材の追加はない。 2026-10-16：問1の整数部分を含む改変に際し、公式公開問題ページの使用案内へ再到達。既存の出典・改変表示と原部分の利用条件を継承し、追加の生成計算・誤答・解説を独自作成として区別する。新たな第三者素材や依存ライブラリの追加はない。"
}
