{
  "schemaVersion": "3.0.0",
  "id": "rights-ipa-2017h29h-fe-pm-13-spreadsheet-instructions",
  "holders": [
    "独立行政法人情報処理推進機構（IPA）"
  ],
  "basis": "official_policy",
  "checkedOn": "2026-10-26",
  "evidence": [
    {
      "sourceId": "source-ipa-faq",
      "locator": {
        "section": "その他／試験の過去問題の使用方法／留意点"
      }
    },
    {
      "sourceId": "source-ipa-2017h29h-fe-pm-13-qs",
      "locator": {
        "section": "平成29年度 春期 基本情報技術者試験 午後 付属資料 表計算ソフトの機能・用語",
        "page": 78,
        "year": 2017,
        "period": "春期",
        "exam": "基本情報技術者試験",
        "subject": "午後",
        "timeSlot": "午後",
        "questionNumber": "13"
      }
    },
    {
      "sourceId": "source-ipa-2017h29h-fe-pm-13-qs",
      "locator": {
        "section": "平成29年度 春期 基本情報技術者試験 午後 付属資料 表計算ソフトの機能・用語",
        "page": 79,
        "year": 2017,
        "period": "春期",
        "exam": "基本情報技術者試験",
        "subject": "午後",
        "timeSlot": "午後",
        "questionNumber": "13"
      }
    },
    {
      "sourceId": "source-ipa-2017h29h-fe-pm-13-qs",
      "locator": {
        "section": "平成29年度 春期 基本情報技術者試験 午後 付属資料 表計算ソフトの機能・用語",
        "page": 80,
        "year": 2017,
        "period": "春期",
        "exam": "基本情報技術者試験",
        "subject": "午後",
        "timeSlot": "午後",
        "questionNumber": "13"
      }
    },
    {
      "sourceId": "source-ipa-2017h29h-fe-pm-13-qs",
      "locator": {
        "section": "平成29年度 春期 基本情報技術者試験 午後 付属資料 表計算ソフトの機能・用語",
        "page": 81,
        "year": 2017,
        "period": "春期",
        "exam": "基本情報技術者試験",
        "subject": "午後",
        "timeSlot": "午後",
        "questionNumber": "13"
      }
    },
    {
      "sourceId": "source-ipa-2017h29h-fe-pm-13-qs",
      "locator": {
        "section": "平成29年度 春期 基本情報技術者試験 午後 付属資料 表計算ソフトの機能・用語",
        "page": 82,
        "year": 2017,
        "period": "春期",
        "exam": "基本情報技術者試験",
        "subject": "午後",
        "timeSlot": "午後",
        "questionNumber": "13"
      }
    },
    {
      "sourceId": "source-ipa-2017h29h-fe-pm-13-qs",
      "locator": {
        "section": "平成29年度 春期 基本情報技術者試験 午後 付属資料 表計算ソフトの機能・用語",
        "page": 83,
        "year": 2017,
        "period": "春期",
        "exam": "基本情報技術者試験",
        "subject": "午後",
        "timeSlot": "午後",
        "questionNumber": "13"
      }
    }
  ],
  "scope": "2017春午後付属資料p78〜83の表計算ソフトの機能・用語。全関数の原定義・比較/複写・数値以外の扱い・マクロの原記法と前提を含む。別年度版や商用ソフトの公式マニュアルではない。",
  "uses": {
    "repositoryRedistribution": "allowed",
    "browserDisplay": "allowed",
    "adaptation": "allowed"
  },
  "licenseId": "LicenseRef-IPA-Public-Questions",
  "modificationNoticeRequired": true,
  "attributionText": "出典：平成29年度 春期 基本情報技術者試験 午後 表計算ソフトの機能・用語 p78〜83／©2017 独立行政法人情報処理推進機構（IPA）",
  "thirdParty": {
    "status": "none_identified",
    "notes": "全88頁の素材監査とp78〜83の必要範囲照合に基づく限定判断。確認範囲で第三者の具体的な規格文言・外部図の転載を特定しなかった。CASL資料や未確認の文字符号表へ適用しない。",
    "rightsRefs": []
  },
  "assessmentNotes": "IPA FAQ教育目的/出典/改変表示に基づく同梱・ブラウザ・学習用改変の用途別判断。原DCT streamを直接抽出し、JPEG再圧縮なしで同じ画素をlossless WebP化。付属資料の固定版を保持し、生成本文の数値変更と区別する。"
}
