{
  "schemaVersion": "3.0.0",
  "id": "rights-ipa-2017h29h-fe-pm-3",
  "holders": [
    "独立行政法人情報処理推進機構（IPA）"
  ],
  "basis": "official_policy",
  "checkedOn": "2026-10-23",
  "evidence": [
    {
      "sourceId": "source-ipa-faq",
      "locator": {
        "section": "その他／試験の過去問題の使用方法／留意点"
      }
    }
  ],
  "scope": "2017春午後問3 p13〜16の原本文/21択/4表下線/表1/DDL/5欄/注意書き、公式解答p1問3のみ。",
  "uses": {
    "repositoryRedistribution": "allowed",
    "browserDisplay": "allowed",
    "adaptation": "allowed"
  },
  "licenseId": "LicenseRef-IPA-Public-Questions",
  "modificationNoticeRequired": true,
  "attributionText": "出典：平成29年度 春期 基本情報技術者試験 午後 問3／©2017 独立行政法人情報処理推進機構（IPA）",
  "thirdParty": {
    "status": "none_identified",
    "notes": "全4頁を個別目視し、架空W市の汎用関係表/SQL制約の作問に具体的な第三者引用文/規格図/実自治体規程/写真を特定しなかった。無表示だけから権利不存在を証明した意味ではない。外部SQL公式文書は意味事実の照合のみで文や例を転載しない。",
    "rightsRefs": []
  },
  "assessmentNotes": "IPA FAQの教育目的/出典/改変表示を用途別に適用するプロジェクト判断。Git同梱/ブラウザ表示/学習用改変の個別許諾や法的保証を取得した意味ではない。IPA原部分と管理改変図へMIT/CC0を適用しない。"
}
